[{"assumption_ids":["ASSUMPTION-UC4-002"],"attributes":{"authorization_relevance":"none","data_types":["context"],"interface":"model","notes":"Static scope relation","protocol":"N/A"},"confidence":"high","description":"Smart-home premises is in UC4","record_status":"agreed_decision","relationship_id":"UC4-REL-001","relationship_type":"BELONGS_TO_USE_CASE","schema_version":"1.0.0","source_entity":"UC4-ENV01","source_references":["AGREED-UC4-001"],"target_entity":"UC4","use_case":"UC4","valid_from":null,"valid_to":null},{"assumption_ids":["ASSUMPTION-UC4-003"],"attributes":{"authorization_relevance":"none","data_types":["network_context"],"interface":"model","notes":"Static scope relation","protocol":"N/A"},"confidence":"high","description":"Home IoT LAN is in UC4","record_status":"proposed","relationship_id":"UC4-REL-002","relationship_type":"BELONGS_TO_USE_CASE","schema_version":"1.0.0","source_entity":"UC4-NZ01","source_references":["PROPOSAL-PDF-p169-p170"],"target_entity":"UC4","use_case":"UC4","valid_from":null,"valid_to":null},{"assumption_ids":["ASSUMPTION-UC4-005"],"attributes":{"authorization_relevance":"none","data_types":["network_context"],"interface":"model","notes":"Static scope relation","protocol":"N/A"},"confidence":"high","description":"WAN boundary is in UC4","record_status":"proposed","relationship_id":"UC4-REL-003","relationship_type":"BELONGS_TO_USE_CASE","schema_version":"1.0.0","source_entity":"UC4-NZ02","source_references":["PROPOSAL-PDF-p169-p170"],"target_entity":"UC4","use_case":"UC4","valid_from":null,"valid_to":null},{"assumption_ids":["ASSUMPTION-UC4-014"],"attributes":{"authorization_relevance":"none","data_types":["network_context"],"interface":"model","notes":"Static scope relation","protocol":"N/A"},"confidence":"high","description":"LEA secured environment is in UC4","record_status":"proposed","relationship_id":"UC4-REL-004","relationship_type":"BELONGS_TO_USE_CASE","schema_version":"1.0.0","source_entity":"UC4-NZ03","source_references":["ROADMAP-Phase-5"],"target_entity":"UC4","use_case":"UC4","valid_from":null,"valid_to":null},{"assumption_ids":["ASSUMPTION-UC4-003"],"attributes":{"authorization_relevance":"none","data_types":["entity"],"interface":"model","notes":"Static scope relation","protocol":"N/A"},"confidence":"high","description":"CPE router is in UC4","record_status":"proposal","relationship_id":"UC4-REL-005","relationship_type":"BELONGS_TO_USE_CASE","schema_version":"1.0.0","source_entity":"UC4-D01","source_references":["PROPOSAL-PDF-p169-p170"],"target_entity":"UC4","use_case":"UC4","valid_from":null,"valid_to":null},{"assumption_ids":["ASSUMPTION-UC4-003"],"attributes":{"authorization_relevance":"none","data_types":["entity"],"interface":"model","notes":"Static scope relation","protocol":"N/A"},"confidence":"high","description":"Home Assistant host is in UC4","record_status":"proposal","relationship_id":"UC4-REL-006","relationship_type":"BELONGS_TO_USE_CASE","schema_version":"1.0.0","source_entity":"UC4-D02","source_references":["PROPOSAL-PDF-p169-p170"],"target_entity":"UC4","use_case":"UC4","valid_from":null,"valid_to":null},{"assumption_ids":["ASSUMPTION-UC4-001"],"attributes":{"authorization_relevance":"none","data_types":["entity"],"interface":"model","notes":"Static scope relation","protocol":"N/A"},"confidence":"high","description":"Door sensor is in UC4","record_status":"proposal","relationship_id":"UC4-REL-007","relationship_type":"BELONGS_TO_USE_CASE","schema_version":"1.0.0","source_entity":"UC4-D03","source_references":["PROPOSAL-PDF-p169-p170"],"target_entity":"UC4","use_case":"UC4","valid_from":null,"valid_to":null},{"assumption_ids":["ASSUMPTION-UC4-009"],"attributes":{"authorization_relevance":"none","data_types":["entity"],"interface":"model","notes":"Static scope relation","protocol":"N/A"},"confidence":"high","description":"Presence sensor is in UC4","record_status":"proposal","relationship_id":"UC4-REL-008","relationship_type":"BELONGS_TO_USE_CASE","schema_version":"1.0.0","source_entity":"UC4-D04","source_references":["PROPOSAL-PDF-p169-p170"],"target_entity":"UC4","use_case":"UC4","valid_from":null,"valid_to":null},{"assumption_ids":["ASSUMPTION-UC4-011"],"attributes":{"authorization_relevance":"none","data_types":["entity"],"interface":"model","notes":"Static scope relation","protocol":"N/A"},"confidence":"high","description":"Smart plug is in UC4","record_status":"proposal","relationship_id":"UC4-REL-009","relationship_type":"BELONGS_TO_USE_CASE","schema_version":"1.0.0","source_entity":"UC4-D05","source_references":["PROPOSAL-PDF-p169-p170"],"target_entity":"UC4","use_case":"UC4","valid_from":null,"valid_to":null},{"assumption_ids":["ASSUMPTION-UC4-010"],"attributes":{"authorization_relevance":"none","data_types":["entity"],"interface":"model","notes":"Static scope relation","protocol":"N/A"},"confidence":"high","description":"Smart light is in UC4","record_status":"proposal","relationship_id":"UC4-REL-010","relationship_type":"BELONGS_TO_USE_CASE","schema_version":"1.0.0","source_entity":"UC4-D06","source_references":["PROPOSAL-PDF-p169-p170"],"target_entity":"UC4","use_case":"UC4","valid_from":null,"valid_to":null},{"assumption_ids":["ASSUMPTION-UC4-021"],"attributes":{"authorization_relevance":"none","data_types":["twin"],"interface":"model","notes":"Static scope relation","protocol":"N/A"},"confidence":"high","description":"CPE twin is in UC4","record_status":"proposed","relationship_id":"UC4-REL-011","relationship_type":"BELONGS_TO_USE_CASE","schema_version":"1.0.0","source_entity":"UC4-DT01","source_references":["PROPOSAL-PDF-p162-p164"],"target_entity":"UC4","use_case":"UC4","valid_from":null,"valid_to":null},{"assumption_ids":["ASSUMPTION-UC4-021"],"attributes":{"authorization_relevance":"none","data_types":["twin"],"interface":"model","notes":"Static scope relation","protocol":"N/A"},"confidence":"high","description":"Home Assistant twin is in UC4","record_status":"proposed","relationship_id":"UC4-REL-012","relationship_type":"BELONGS_TO_USE_CASE","schema_version":"1.0.0","source_entity":"UC4-DT02","source_references":["PROPOSAL-PDF-p162-p164"],"target_entity":"UC4","use_case":"UC4","valid_from":null,"valid_to":null},{"assumption_ids":["ASSUMPTION-UC4-021"],"attributes":{"authorization_relevance":"none","data_types":["twin"],"interface":"model","notes":"Static scope relation","protocol":"N/A"},"confidence":"high","description":"Door sensor twin is in UC4","record_status":"proposed","relationship_id":"UC4-REL-013","relationship_type":"BELONGS_TO_USE_CASE","schema_version":"1.0.0","source_entity":"UC4-DT03","source_references":["PROPOSAL-PDF-p162-p164"],"target_entity":"UC4","use_case":"UC4","valid_from":null,"valid_to":null},{"assumption_ids":["ASSUMPTION-UC4-021"],"attributes":{"authorization_relevance":"none","data_types":["twin"],"interface":"model","notes":"Static scope relation","protocol":"N/A"},"confidence":"high","description":"Presence sensor twin is in UC4","record_status":"proposed","relationship_id":"UC4-REL-014","relationship_type":"BELONGS_TO_USE_CASE","schema_version":"1.0.0","source_entity":"UC4-DT04","source_references":["PROPOSAL-PDF-p162-p164"],"target_entity":"UC4","use_case":"UC4","valid_from":null,"valid_to":null},{"assumption_ids":["ASSUMPTION-UC4-021"],"attributes":{"authorization_relevance":"none","data_types":["twin"],"interface":"model","notes":"Static scope relation","protocol":"N/A"},"confidence":"high","description":"Smart-plug twin is in UC4","record_status":"proposed","relationship_id":"UC4-REL-015","relationship_type":"BELONGS_TO_USE_CASE","schema_version":"1.0.0","source_entity":"UC4-DT05","source_references":["PROPOSAL-PDF-p162-p164"],"target_entity":"UC4","use_case":"UC4","valid_from":null,"valid_to":null},{"assumption_ids":["ASSUMPTION-UC4-021"],"attributes":{"authorization_relevance":"none","data_types":["twin"],"interface":"model","notes":"Static scope relation","protocol":"N/A"},"confidence":"high","description":"Smart-light twin is in UC4","record_status":"proposed","relationship_id":"UC4-REL-016","relationship_type":"BELONGS_TO_USE_CASE","schema_version":"1.0.0","source_entity":"UC4-DT06","source_references":["PROPOSAL-PDF-p162-p164"],"target_entity":"UC4","use_case":"UC4","valid_from":null,"valid_to":null},{"assumption_ids":["ASSUMPTION-UC4-014"],"attributes":{"authorization_relevance":"none","data_types":["service"],"interface":"model","notes":"Static scope relation","protocol":"N/A"},"confidence":"high","description":"Lawful-interception module is in UC4","record_status":"proposal","relationship_id":"UC4-REL-018","relationship_type":"BELONGS_TO_USE_CASE","schema_version":"1.0.0","source_entity":"UC4-S02","source_references":["PROPOSAL-PDF-p169-p170"],"target_entity":"UC4","use_case":"UC4","valid_from":null,"valid_to":null},{"assumption_ids":["ASSUMPTION-UC4-023"],"attributes":{"authorization_relevance":"none","data_types":["service"],"interface":"model","notes":"Static scope relation","protocol":"N/A"},"confidence":"high","description":"Evidence repository is in UC4","record_status":"proposed","relationship_id":"UC4-REL-019","relationship_type":"BELONGS_TO_USE_CASE","schema_version":"1.0.0","source_entity":"UC4-S03","source_references":["PROPOSAL-PDF-p163-p164"],"target_entity":"UC4","use_case":"UC4","valid_from":null,"valid_to":null},{"assumption_ids":["ASSUMPTION-UC4-023"],"attributes":{"authorization_relevance":"none","data_types":["service"],"interface":"model","notes":"Static scope relation","protocol":"N/A"},"confidence":"high","description":"Custody adapter is in UC4","record_status":"proposed","relationship_id":"UC4-REL-020","relationship_type":"BELONGS_TO_USE_CASE","schema_version":"1.0.0","source_entity":"UC4-S04","source_references":["PROPOSAL-PDF-p163-p164"],"target_entity":"UC4","use_case":"UC4","valid_from":null,"valid_to":null},{"assumption_ids":["ASSUMPTION-UC4-024"],"attributes":{"authorization_relevance":"none","data_types":["service"],"interface":"model","notes":"S